Student_ID,Last_Name,First_Name,Class_Period,Course_Name,Week_Number,Week_Start_Date,Assignment_Name,Category,Score,Proficiency_Level,Language_Status,Behavior_Score,Engagement_Score,Attendance,Raise_Value,Dashboard_Tag,Teacher_Comment,Parent_Contact_Date,Support_Type,AI_Feedback_Score,Reflection_Entry,Data_Source,Rolling_Avg_By_Student,Behavior_Perf_Ratio,Record_Type
ALA-25-3-001,Martinez,Sophia,3,CTE – App Design,1,2025-07-28,App UI Prototype,Explain,97.4,Exceeds,Native English,4.8,4.6,Present,Excellence,Honors,Exceptional progress; continue mentoring peers.,,General Ed,9.3,Loves design challenges.,CTE_MasterData,95.8,0.99,Real_Student
ALA-25-3-002,Nguyen,Ethan,3,CTE – App Design,1,2025-07-28,App UI Prototype,Explain,95.6,Exceeds,Reclassified,4.5,4.4,Present,Integrity,Honors,Consistent excellence; great group leadership.,,General Ed,9.1,Shows initiative in coding projects.,CTE_MasterData,93.7,1.02,Real_Student
ALA-25-3-003,Lopez,Valeria,3,CTE – App Design,1,2025-07-28,App UI Prototype,Explain,94.2,Exceeds,ELL,4.3,4.5,Present,Service,Honors,Creative use of bilingual UI elements.,,ESS,8.9,Balances creativity and precision.,CTE_MasterData,92.9,1.04,Real_Student
ALA-25-3-004,Reed,Carter,3,CTE – App Design,1,2025-07-28,App UI Prototype,Explain,91.5,Exceeds,Native English,4.2,4,Present,Accountability,Honors,Great improvement in code documentation.,,504,8.5,Strong logical reasoning.,CTE_MasterData,89.8,1,Real_Student
ALA-25-3-005,Patel,Anaya,3,CTE – App Design,1,2025-07-28,App UI Prototype,Explain,89.8,Meets,Reclassified,4,3.9,Present,Respect,On Track,Consistent B+ work; refine debugging efficiency.,,General Ed,8.1,Enjoys project-based learning.,CTE_MasterData,87.2,0.94,Real_Student
ALA-25-3-006,Brown,Mason,3,CTE – App Design,1,2025-07-28,App UI Prototype,Explain,88.6,Meets,Native English,3.9,3.8,Present,Integrity,On Track,Shows steady growth; maintain focus on logic flow.,,General Ed,7.8,Responds well to feedback.,CTE_MasterData,86,0.93,Real_Student
ALA-25-3-007,Gomez,Elena,3,CTE – App Design,1,2025-07-28,App UI Prototype,Explain,92.1,Exceeds,ELL,4.4,4.1,Present,Excellence,Honors,High creativity; integrates feedback effectively.,,ESS,8.6,Thrives in group collaboration.,CTE_MasterData,90.4,0.98,Real_Student
ALA-25-3-008,Ali,Yusuf,3,CTE – App Design,1,2025-07-28,App UI Prototype,Explain,93.3,Exceeds,Reclassified,4.3,4.5,Present,Service,Honors,Outstanding attention to interface detail.,,General Ed,8.8,Strong leadership in design sprints.,CTE_MasterData,91.5,1.01,Real_Student
ALA-25-3-009,Ramirez,Isabella,3,CTE – App Design,1,2025-07-28,App UI Prototype,Explain,91.7,Exceeds,Native English,4.2,4.1,Present,Accountability,Honors,Consistent growth; confident communicator.,,504,8.4,Excellent time management.,CTE_MasterData,90.2,0.97,Real_Student
ALA-25-3-010,Chen,Liam,3,CTE – App Design,1,2025-07-28,App UI Prototype,Explain,90.5,Exceeds,Reclassified,4.3,4,Present,Integrity,Honors,Dependable and thoughtful peer collaborator.,,General Ed,8.3,Enjoys analytical challenges.,CTE_MasterData,89,0.96,Real_Student
ALA-25-3-011,Sanchez,Maria,3,CTE – App Design,1,2025-07-28,App UI Prototype,Explain,86.4,Meets,ELL,3.8,3.6,Present,Respect,On Track,Strong ideas; work on presentation clarity.,,ESS,7.4,Improving rubric consistency.,CTE_MasterData,84.2,0.89,Simulation
ALA-25-3-012,Johnson,Lucas,3,CTE – App Design,1,2025-07-28,App UI Prototype,Explain,83.2,Approaching,Native English,3.6,3.3,Tardy,Service,At-Risk,Re-teach: reinforce code structure consistency.,2025-10-17,General Ed,6.9,Shows potential with more time.,CTE_MasterData,82,0.85,Simulation
ALA-25-3-013,Tran,Linh,3,CTE – App Design,1,2025-07-28,App UI Prototype,Explain,78.2,Approaching,Reclassified,3.4,3.2,Present,Accountability,At-Risk,Provide extra feedback on UI logic.,2025-10-17,General Ed,6.4,Needs structured pacing.,CTE_MasterData,79.9,0.82,Simulation
ALA-25-3-014,Baker,Noemi,3,CTE – App Design,1,2025-07-28,App UI Prototype,Explain,75.5,Below,Native English,3.3,3,Present,Service,At-Risk,Schedule re-teach; reinforce syntax foundations.,2025-10-17,General Ed,6.1,Motivated but needs scaffolds.,CTE_MasterData,77,0.79,Simulation
ALA-25-4-001,Patel,Aarav,4,AP Pre-Calculus,1,2025-07-28,Trigonometric Identities Lab,Explain,98.1,Exceeds,Reclassified,4.8,4.7,Present,Excellence,Honors,Outstanding mastery of proofs and precision.,,General Ed,9.4,Peer tutor candidate; leads review sessions.,PreCalc_MasterData,96.9,1,Real_Student
ALA-25-4-002,Johnson,Aaliyah,4,AP Pre-Calculus,1,2025-07-28,Trigonometric Identities Lab,Explain,96.7,Exceeds,Native English,4.6,4.4,Present,Integrity,Honors,Excellent conceptual understanding; continues to excel.,,General Ed,9.2,Strong leadership during group analysis.,PreCalc_MasterData,94.8,1.02,Real_Student
ALA-25-4-003,Garcia,Mateo,4,AP Pre-Calculus,1,2025-07-28,Trigonometric Identities Lab,Explain,94.9,Exceeds,ELL,4.4,4.5,Present,Service,Honors,High engagement; continues to exceed expectations.,,ESS,8.9,Balances theory and applied problem solving.,PreCalc_MasterData,92.7,1.03,Real_Student
ALA-25-4-004,Rivera,Lucia,4,AP Pre-Calculus,1,2025-07-28,Trigonometric Identities Lab,Explain,92.8,Exceeds,Reclassified,4.3,4.2,Present,Accountability,Honors,Excellent reasoning; confident use of multiple strategies.,,General Ed,8.6,Enjoys complex challenges.,PreCalc_MasterData,91.2,0.98,Real_Student
ALA-25-4-005,Hernandez,Sofia,4,AP Pre-Calculus,1,2025-07-28,Trigonometric Identities Lab,Explain,91.4,Exceeds,Native English,4.2,4.1,Present,Respect,Honors,Demonstrates depth of understanding across units.,,IEP,8.4,Highly reflective; applies feedback effectively.,PreCalc_MasterData,89.7,0.97,Real_Student
ALA-25-4-006,Thompson,Caleb,4,AP Pre-Calculus,1,2025-07-28,Trigonometric Identities Lab,Explain,95.8,Exceeds,Native English,4.5,4.6,Present,Excellence,Honors,Fluent with unit circle and trigonometric proofs.,,General Ed,9.1,Model student work ethic.,PreCalc_MasterData,93.9,1.01,Real_Student
ALA-25-4-007,Kim,Isabella,4,AP Pre-Calculus,1,2025-07-28,Trigonometric Identities Lab,Explain,94.3,Exceeds,Reclassified,4.3,4.2,Present,Service,Honors,Analytical thinker; strong use of graphing tech.,,General Ed,8.8,Communicates math reasoning clearly.,PreCalc_MasterData,92.5,1,Real_Student
ALA-25-4-008,Clark,Daniel,4,AP Pre-Calculus,1,2025-07-28,Trigonometric Identities Lab,Explain,93.5,Exceeds,Native English,4.2,4.3,Present,Integrity,Honors,High engagement; precise and thorough work.,,504,8.7,Collaborative and self-motivated.,PreCalc_MasterData,91.4,0.99,Real_Student
ALA-25-4-009,Nguyen,Linh,4,AP Pre-Calculus,1,2025-07-28,Trigonometric Identities Lab,Explain,92.6,Exceeds,ELL,4.3,4.1,Present,Respect,Honors,Excellent participation; connects new and prior knowledge.,,ESS,8.5,Growth in written explanations.,PreCalc_MasterData,90.6,0.96,Real_Student
ALA-25-4-010,Owens,Natalie,4,AP Pre-Calculus,1,2025-07-28,Trigonometric Identities Lab,Explain,90.7,Exceeds,Native English,4.1,4,Present,Integrity,Honors,Strong analytical and critical thinking skills.,,General Ed,8.2,Balances accuracy with creativity.,PreCalc_MasterData,89.1,0.95,Real_Student
ALA-25-4-011,Murphy,Leo,4,AP Pre-Calculus,1,2025-07-28,Trigonometric Identities Lab,Explain,89.2,Meets,Reclassified,4,3.8,Present,Service,On Track,Consistent performer; strengthen algebraic fluency.,,General Ed,8,Responds well to targeted feedback.,PreCalc_MasterData,87.4,0.94,Real_Student
ALA-25-4-012,Williams,Audrey,4,AP Pre-Calculus,1,2025-07-28,Trigonometric Identities Lab,Explain,86.7,Meets,Native English,3.9,3.6,Present,Respect,On Track,Good understanding; increase speed on assessments.,,General Ed,7.5,Capable and diligent.,PreCalc_MasterData,84.9,0.9,Simulation
ALA-25-4-013,Sharma,Rohan,4,AP Pre-Calculus,1,2025-07-28,Trigonometric Identities Lab,Explain,82.3,Approaching,ELL,3.7,3.4,Present,Accountability,At-Risk,Needs review on trig functions; assign re-teach session.,2025-10-17,ESS,6.8,Shows persistence but needs support.,PreCalc_MasterData,81,0.86,Simulation
ALA-25-4-014,Baker,Lauren,4,AP Pre-Calculus,1,2025-07-28,Trigonometric Identities Lab,Explain,79.8,Approaching,Native English,3.6,3.2,Present,Service,At-Risk,Encourage extra practice on graph transformations.,2025-10-17,General Ed,6.5,Attitude improving; seek consistency.,PreCalc_MasterData,78.5,0.82,Simulation
ALA-25-5-001,Williams,Jayden,5,AP Calculus AB,1,2025-07-28,Derivative Applications Project,Explain,97.9,Exceeds,Native English,4.9,4.8,Present,Excellence,Honors,Outstanding grasp of optimization and related rates.,,General Ed,9.5,Leads peers during group modeling.,Calc_MasterData,96.3,1.03,Real_Student
ALA-25-5-002,Chen,Mei,5,AP Calculus AB,1,2025-07-28,Derivative Applications Project,Explain,95.2,Exceeds,Reclassified,4.6,4.4,Present,Integrity,Honors,Precise and articulate in written justifications.,,General Ed,9,Thrives in abstract reasoning.,Calc_MasterData,93.4,1.01,Real_Student
ALA-25-5-003,Martinez,Carlos,5,AP Calculus AB,1,2025-07-28,Derivative Applications Project,Explain,93.8,Exceeds,ELL,4.4,4.2,Present,Service,Honors,Shows exceptional growth with limits and continuity.,,ESS,8.7,Strong visual learner.,Calc_MasterData,91.6,0.98,Real_Student
ALA-25-5-004,Brown,Emily,5,AP Calculus AB,1,2025-07-28,Derivative Applications Project,Explain,91.6,Exceeds,Native English,4.2,4.1,Present,Accountability,Honors,Demonstrates mastery of differentiation concepts.,,General Ed,8.5,Balances leadership with humility.,Calc_MasterData,89.9,0.96,Real_Student
ALA-25-5-005,Ali,Zara,5,AP Calculus AB,1,2025-07-28,Derivative Applications Project,Explain,90.8,Exceeds,Reclassified,4.1,4,Present,Respect,Honors,Strong on conceptual proofs; improve labeling accuracy.,,504,8.3,Excellent class contributor.,Calc_MasterData,89,0.95,Real_Student
ALA-25-5-006,Ramirez,Noah,5,AP Calculus AB,1,2025-07-28,Derivative Applications Project,Explain,85.9,Meets,ELL,3.9,3.7,Present,Integrity,On Track,Needs additional support with integration setup.,,ESS,7.6,Eager participant; gains confidence weekly.,Calc_MasterData,84.4,0.91,Simulation
ALA-25-5-007,Thompson,Lila,5,AP Calculus AB,1,2025-07-28,Derivative Applications Project,Explain,82.1,Approaching,Native English,3.6,3.4,Present,Service,At-Risk,Revisit u-substitution; assign tutoring block.,2025-10-17,General Ed,6.9,Motivated but struggles with speed.,Calc_MasterData,81,0.87,Simulation
ALA-25-5-008,Hassan,Omar,5,AP Calculus AB,1,2025-07-28,Derivative Applications Project,Explain,78.4,Approaching,Reclassified,3.4,3.2,Tardy,Accountability,At-Risk,Review chain rule; reinforce step-by-step reasoning.,2025-10-17,General Ed,6.3,Positive outlook; responds well to 1:1 support.,Calc_MasterData,79.2,0.82,Simulation
ALA-25-7-002,Khan,Amina,7,Intro to Computer Science,1,2025-07-28,Python Loops Challenge,Explain,95.9,Exceeds,ELL,4.6,4.4,Present,Integrity,Honors,Creative problem-solver; strong debugging logic.,,ESS,9.1,Engages peers in discussion.,CompSci_MasterData,94,1,Real_Student
ALA-25-7-003,Ochoa,Valeria,7,Intro to Computer Science,1,2025-07-28,Python Loops Challenge,Explain,94.6,Exceeds,Reclassified,4.4,4.2,Present,Service,Honors,Excellent analytical reasoning and syntax clarity.,,General Ed,8.8,Positive collaborator in all tasks.,CompSci_MasterData,92.9,0.99,Real_Student
ALA-25-7-004,Rodriguez,Angel,7,Intro to Computer Science,1,2025-07-28,Python Loops Challenge,Explain,93.7,Exceeds,Native English,4.3,4.1,Present,Accountability,Honors,Consistent performance; high code readability.,,General Ed,8.7,Dependable contributor to team projects.,CompSci_MasterData,91.8,0.97,Real_Student
ALA-25-7-005,Hassan,Yusuf,7,Intro to Computer Science,1,2025-07-28,Python Loops Challenge,Explain,92.9,Exceeds,Reclassified,4.3,4,Present,Respect,Honors,Strong comprehension of nested loops.,,General Ed,8.5,Applies theory accurately to practice.,CompSci_MasterData,90.9,0.96,Real_Student
ALA-25-7-006,Nguyen,Sarah,7,Intro to Computer Science,1,2025-07-28,Python Loops Challenge,Explain,91.3,Exceeds,ELL,4.2,4,Present,Integrity,Honors,Highly engaged; mentors peers in syntax repair.,,ESS,8.4,Collaborative and confident communicator.,CompSci_MasterData,89.5,0.95,Real_Student
ALA-25-7-007,Thompson,Leo,7,Intro to Computer Science,1,2025-07-28,Python Loops Challenge,Explain,90.5,Exceeds,Native English,4.1,3.9,Present,Service,Honors,Dependable participation; consistent code accuracy.,,General Ed,8.3,Balances logic and creativity.,CompSci_MasterData,88.9,0.94,Real_Student
ALA-25-7-008,Baker,Sophia,7,Intro to Computer Science,1,2025-07-28,Python Loops Challenge,Explain,89.8,Meets,Reclassified,4,3.8,Present,Respect,On Track,Good grasp of loop efficiency; continue practice.,,General Ed,8,Positive classroom influence.,CompSci_MasterData,87.4,0.92,Real_Student
ALA-25-7-009,Williams,Noah,7,Intro to Computer Science,1,2025-07-28,Python Loops Challenge,Explain,88.4,Meets,Native English,3.9,3.7,Present,Accountability,On Track,Capable and thorough; refine time management.,,504,7.8,Shows initiative on projects.,CompSci_MasterData,86,0.91,Real_Student
ALA-25-7-010,Ali,Hana,7,Intro to Computer Science,1,2025-07-28,Python Loops Challenge,Explain,87.2,Meets,ELL,3.8,3.6,Present,Excellence,On Track,Good logic structure; encourage more documentation.,,General Ed,7.6,Quiet but precise contributor.,CompSci_MasterData,84.7,0.89,Real_Student
ALA-25-7-011,Garcia,Luis,7,Intro to Computer Science,1,2025-07-28,Python Loops Challenge,Explain,84.9,Approaching,Reclassified,3.7,3.5,Present,Integrity,On Track,Encourage deeper annotation habits.,,ESS,7,Improving steadily; asks strong questions.,CompSci_MasterData,83.3,0.87,Simulation
ALA-25-7-012,Patel,Emily,7,Intro to Computer Science,1,2025-07-28,Python Loops Challenge,Explain,82.6,Approaching,Native English,3.5,3.3,Present,Service,At-Risk,Reinforce function syntax through guided re-teach.,2025-10-17,General Ed,6.8,Friendly and engaged; needs structured pacing.,CompSci_MasterData,81.5,0.84,Simulation
ALA-25-7-013,Reed,Aaron,7,Intro to Computer Science,1,2025-07-28,Python Loops Challenge,Explain,79.3,Approaching,Reclassified,3.4,3.2,Tardy,Respect,At-Risk,Needs more practice with logic operators.,2025-10-17,504,6.4,Improving with consistent check-ins.,CompSci_MasterData,78.1,0.81,Simulation
ALA-25-7-014,Nguyen,Isabella,7,Intro to Computer Science,1,2025-07-28,Python Loops Challenge,Explain,76.8,Below,ELL,3.2,3,Present,Accountability,At-Risk,Schedule re-teach; review algorithm structure.,2025-10-17,General Ed,6,Willing learner; reinforce fundamentals.,CompSci_MasterData,77,0.79,Simulation